//1901CS75
//Siddharth Sanskritayan
//Assignment-9

Task 1:

1.1 SubTask A: Define the table and load data into it from the CSV file

//Create table

mysql> create table transactions
    -> (Series_reference varchar(20),
    -> Period decimal(6,2),
    -> Data_value double(12,2),
    -> Suppressed varchar(20),
    -> Status char(1),
    -> Units varchar(20),
    -> Magnitude int,
    -> Subject varchar(100),
    -> Group_Name varchar(100),
    -> Series_title_1 varchar(100),
    -> Series_title_2 varchar(100),
    -> Series_title_3 varchar(100),
    -> Series_title_4 varchar(100),
    -> Series_title_5 varchar(100));
Query OK, 0 rows affected, 1 warning (0.15 sec)

//load data from csv file

mysql> load data local infile 'C:/Users/Siddharth/Downloads/transactions.csv' into table transactions fields terminated by ',' enclosed by '"'  lines terminated by '\n' ignore 1 lines (Series_reference, Period, @Data_value, Suppressed, Status, Units, Magnitude, Subject, Group_Name, Series_title_1, Series_title_2, Series_title_3, Series_title_4, Series_title_5) set Data_value = NULLIF(@Data_value, '');
Query OK, 16352 rows affected (0.26 sec)
Records: 16352  Deleted: 0  Skipped: 0  Warnings: 0





//--------------------------------------------------------------------------------------

1.2 SubTask B: Check various queries and monitor the timings

// Select queries

mysql> set profiling = 1;
mysql> select * from transactions where series_reference = "ECTM.S1GT4" and period=2003.07;
mysql> show profiles;

mysql> show profiles;
+----------+------------+-------------------------------------------------------------------------------------+
| Query_ID | Duration   | Query                                                                               |
+----------+------------+-------------------------------------------------------------------------------------+
|        1 | 0.05156275 | select * from transactions where series_reference = "ECTM.S1GT4" and period=2003.07 |
+----------+------------+-------------------------------------------------------------------------------------+
1 row in set, 1 warning (0.00 sec)

+----------+------------+-------------------------------------------------------------------------------------+
| Query_ID | Duration   | Query                                                                               |
+----------+------------+-------------------------------------------------------------------------------------+
|        1 | 0.02082300 | select * from transactions where series_reference = "ECTM.S1GT4" and period=2003.07 |
+----------+------------+-------------------------------------------------------------------------------------+
1 row in set, 1 warning (0.00 sec)

mysql> show profiles;
+----------+------------+-------------------------------------------------------------------------------------+
| Query_ID | Duration   | Query                                                                               |
+----------+------------+-------------------------------------------------------------------------------------+
|        1 | 0.01308775 | select * from transactions where series_reference = "ECTM.S1GT4" and period=2003.07 |
+----------+------------+-------------------------------------------------------------------------------------+
1 row in set, 1 warning (0.00 sec)





//Another query

mysql> set profiling = 1;
Query OK, 0 rows affected, 1 warning (0.00 sec)

mysql> select * from transactions where series_reference = "ECTM.S1GA5" and period <= 2002.07;


+----------+------------+----------------------------------------------------------------------------------------+
| Query_ID | Duration   | Query                                                                                  |
+----------+------------+----------------------------------------------------------------------------------------+
|        1 | 0.01567275 | select * from transactions where series_reference = "ECTM.S1GA5" and period <= 2002.07 |
+----------+------------+----------------------------------------------------------------------------------------+
1 row in set, 1 warning (0.00 sec)

+----------+------------+----------------------------------------------------------------------------------------+
| Query_ID | Duration   | Query                                                                                  |
+----------+------------+----------------------------------------------------------------------------------------+
|        1 | 0.01798500 | select * from transactions where series_reference = "ECTM.S1GA5" and period <= 2002.07 |
+----------+------------+----------------------------------------------------------------------------------------+
1 row in set, 1 warning (0.00 sec)


+----------+------------+----------------------------------------------------------------------------------------+
| Query_ID | Duration   | Query                                                                                  |
+----------+------------+----------------------------------------------------------------------------------------+
|        1 | 0.01831450 | select * from transactions where series_reference = "ECTM.S1GA5" and period <= 2002.07 |
+----------+------------+----------------------------------------------------------------------------------------+
1 row in set, 1 warning (0.00 sec)





//Insert Query

mysql> set profiling = 1;
insert into transactionss values("ECTQ.S4AYP", "2004.01", 50.01, "", "F", "Percent", 0, "Electronic Card Transactions (ANZSIC06) - ECT", "Electronic card transactions by mean and proportion", "Actual", "Debit card usage as a proportion of total ECT value", "Proportion (%)", "", "");
Query OK, 1 row affected (0.01 sec)
show profiles;

+----------+------------+-------------------------------------------------------------------------------------------------------------------------------------------------------------------------------------------------------------------------------------------------------------------------------------------+
| Query_ID | Duration   | Query                                                                                                                                                                                                                                                                                     |
+----------+------------+-------------------------------------------------------------------------------------------------------------------------------------------------------------------------------------------------------------------------------------------------------------------------------------------+
|        1 | 0.01138275 | insert into transactions values("ECTQ.S4AYP", "2004.01", 50.01, "", "F", "Percent", 0, "Electronic Card Transactions (ANZSIC06) - ECT", "Electronic card transactions by mean and proportion", "Actual", "Debit card usage as a proportion of total ECT value", "Proportion (%)", "", "") |
+----------+------------+-------------------------------------------------------------------------------------------------------------------------------------------------------------------------------------------------------------------------------------------------------------------------------------------+
1 row in set, 1 warning (0.00 sec)

+----------+------------+-------------------------------------------------------------------------------------------------------------------------------------------------------------------------------------------------------------------------------------------------------------------------------------------+
| Query_ID | Duration   | Query                                                                                                                                                                                                                                                                                     |
+----------+------------+-------------------------------------------------------------------------------------------------------------------------------------------------------------------------------------------------------------------------------------------------------------------------------------------+
|        1 | 0.00457375 | insert into transactions values("ECTQ.S4AYP", "2004.01", 50.01, "", "F", "Percent", 0, "Electronic Card Transactions (ANZSIC06) - ECT", "Electronic card transactions by mean and proportion", "Actual", "Debit card usage as a proportion of total ECT value", "Proportion (%)", "", "") |
+----------+------------+-------------------------------------------------------------------------------------------------------------------------------------------------------------------------------------------------------------------------------------------------------------------------------------------+
1 row in set, 1 warning (0.00 sec)

+----------+------------+-------------------------------------------------------------------------------------------------------------------------------------------------------------------------------------------------------------------------------------------------------------------------------------------+
| Query_ID | Duration   | Query                                                                                                                                                                                                                                                                                     |
+----------+------------+-------------------------------------------------------------------------------------------------------------------------------------------------------------------------------------------------------------------------------------------------------------------------------------------+
|        1 | 0.01320175 | insert into transactions values("ECTQ.S4AYP", "2004.01", 50.01, "", "F", "Percent", 0, "Electronic Card Transactions (ANZSIC06) - ECT", "Electronic card transactions by mean and proportion", "Actual", "Debit card usage as a proportion of total ECT value", "Proportion (%)", "", "") |
+----------+------------+-------------------------------------------------------------------------------------------------------------------------------------------------------------------------------------------------------------------------------------------------------------------------------------------+
1 row in set, 1 warning (0.00 sec)





//Update Query

set profiling = 1;

update transactions set status = "F" where period > 2000.00 and period < 2001.99;
Query OK, 784 rows affected (0.04 sec)
Rows matched: 784  Changed: 784  Warnings: 0

show profiles;

+----------+------------+----------------------------------------------------------------------------------+
| Query_ID | Duration   | Query                                                                            |
+----------+------------+----------------------------------------------------------------------------------+
|        1 | 0.03926275 | update transactions set status = "F" where period > 2000.00 and period < 2001.99 |
+----------+------------+----------------------------------------------------------------------------------+
1 row in set, 1 warning (0.00 sec)

+----------+------------+----------------------------------------------------------------------------------+
| Query_ID | Duration   | Query                                                                            |
+----------+------------+----------------------------------------------------------------------------------+
|        1 | 0.05296700 | update transactions set status = "F" where period > 2000.00 and period < 2001.99 |
+----------+------------+----------------------------------------------------------------------------------+
1 row in set, 1 warning (0.00 sec)

+----------+------------+----------------------------------------------------------------------------------+
| Query_ID | Duration   | Query                                                                            |
+----------+------------+----------------------------------------------------------------------------------+
|        1 | 0.02346500 | update transactions set status = "F" where period > 2000.00 and period < 2001.99 |
+----------+------------+----------------------------------------------------------------------------------+
1 row in set, 1 warning (0.00 sec)




//Join operation

mysql> create table transaction2
    -> (Series_reference varchar(20),
    -> Period decimal(6,2));
Query OK, 0 rows affected (0.05 sec)

mysql> insert into transaction2(Series_reference,Period)
    -> select Series_reference,Period from transactions;
Query OK, 16356 rows affected (0.14 sec)
Records: 16356  Duplicates: 0  Warnings: 0

set profiling = 1;
create view transactions_join as select * from transaction2 natural join transactions;
show profiles;

+----------+------------+---------------------------------------------------------------------------------------+
| Query_ID | Duration   | Query                                                                                 |
+----------+------------+---------------------------------------------------------------------------------------+
|        1 | 0.14091675 | create view transactions_join as select * from transaction2 natural join transactions |
+----------+------------+---------------------------------------------------------------------------------------+
1 row in set, 1 warning (0.00 sec)





//------------------------------------------------------------------------------------

1.3 SubTask C: Create index on the copied table


mysql> create table new_transactions like transactions;
Query OK, 0 rows affected, 1 warning (0.04 sec)

mysql> insert new_transactions select * from transactions;
Query OK, 16356 rows affected (0.26 sec)
Records: 16356  Duplicates: 0  Warnings: 0

mysql> create index idx on new_transactions(Series_reference, Period);
Query OK, 0 rows affected (0.12 sec)
Records: 0  Duplicates: 0  Warnings: 0





//------------------------------------------------------------------------------------

1.4 SubTask D: Check various queries and monitor the timings

mysql> set profiling = 1;

mysql> select * from new_transactions where series_reference = "ECTM.S1GT4" and period=2003.07;

+----------+------------+-----------------------------------------------------------------------------------------+
| Query_ID | Duration   | Query                                                                                   |
+----------+------------+-----------------------------------------------------------------------------------------+
|        1 | 0.00438850 | select * from new_transactions where series_reference = "ECTM.S1GT4" and period=2003.07 |
+----------+------------+-----------------------------------------------------------------------------------------+
1 row in set, 1 warning (0.00 sec)

+----------+------------+-----------------------------------------------------------------------------------------+
| Query_ID | Duration   | Query                                                                                   |
+----------+------------+-----------------------------------------------------------------------------------------+
|        1 | 0.00048750 | select * from new_transactions where series_reference = "ECTM.S1GT4" and period=2003.07 |
+----------+------------+-----------------------------------------------------------------------------------------+
1 row in set, 1 warning (0.00 sec)

+----------+------------+-----------------------------------------------------------------------------------------+
| Query_ID | Duration   | Query                                                                                   |
+----------+------------+-----------------------------------------------------------------------------------------+
|        1 | 0.00046950 | select * from new_transactions where series_reference = "ECTM.S1GT4" and period=2003.07 |
+----------+------------+-----------------------------------------------------------------------------------------+
1 row in set, 1 warning (0.00 sec)





//Another select query

mysql> set profiling = 1;

mysql> select * from new_transactions where series_reference = "ECTM.S1GA5" and period <= 2002.07;

mysql> show profiles;
+----------+------------+--------------------------------------------------------------------------------------------+
| Query_ID | Duration   | Query                                                                                      |
+----------+------------+--------------------------------------------------------------------------------------------+
|        1 | 0.00088325 | select * from new_transactions where series_reference = "ECTM.S1GA5" and period <= 2002.07 |
+----------+------------+--------------------------------------------------------------------------------------------+
1 row in set, 1 warning (0.00 sec)

+----------+------------+--------------------------------------------------------------------------------------------+
| Query_ID | Duration   | Query                                                                                      |
+----------+------------+--------------------------------------------------------------------------------------------+
|        1 | 0.00056575 | select * from new_transactions where series_reference = "ECTM.S1GA5" and period <= 2002.07 |
+----------+------------+--------------------------------------------------------------------------------------------+
1 row in set, 1 warning (0.00 sec)

+----------+------------+--------------------------------------------------------------------------------------------+
| Query_ID | Duration   | Query                                                                                      |
+----------+------------+--------------------------------------------------------------------------------------------+
|        1 | 0.00093850 | select * from new_transactions where series_reference = "ECTM.S1GA5" and period <= 2002.07 |
+----------+------------+--------------------------------------------------------------------------------------------+
1 row in set, 1 warning (0.00 sec)





// Insert Query

mysql> set profiling=1;
Query OK, 0 rows affected, 1 warning (0.00 sec)

mysql> insert into new_transactions values("ECTQ.S4AYP", "2004.01", 50.01, "", "F", "Percent", 0, "Electronic Card Transactions (ANZSIC06) - ECT", "Electronic card transactions by mean and proportion", "Actual", "Debit card usage as a proportion of total ECT value", "Proportion (%)", "", "");
Query OK, 1 row affected (0.05 sec)

mysql> show profiles;
+----------+------------+-----------------------------------------------------------------------------------------------------------------------------------------------------------------------------------------------------------------------------------------------------------------------------------------------+
| Query_ID | Duration   | Query                                                                                                                                                                                                                                                                                         |
+----------+------------+-----------------------------------------------------------------------------------------------------------------------------------------------------------------------------------------------------------------------------------------------------------------------------------------------+
|        1 | 0.04937275 | insert into new_transactions values("ECTQ.S4AYP", "2004.01", 50.01, "", "F", "Percent", 0, "Electronic Card Transactions (ANZSIC06) - ECT", "Electronic card transactions by mean and proportion", "Actual", "Debit card usage as a proportion of total ECT value", "Proportion (%)", "", "") |
+----------+------------+-----------------------------------------------------------------------------------------------------------------------------------------------------------------------------------------------------------------------------------------------------------------------------------------------+
1 row in set, 1 warning (0.00 sec)

+----------+------------+-----------------------------------------------------------------------------------------------------------------------------------------------------------------------------------------------------------------------------------------------------------------------------------------------+
| Query_ID | Duration   | Query                                                                                                                                                                                                                                                                                         |
+----------+------------+-----------------------------------------------------------------------------------------------------------------------------------------------------------------------------------------------------------------------------------------------------------------------------------------------+
|        1 | 0.04866800 | insert into new_transactions values("ECTQ.S4AYP", "2004.01", 50.01, "", "F", "Percent", 0, "Electronic Card Transactions (ANZSIC06) - ECT", "Electronic card transactions by mean and proportion", "Actual", "Debit card usage as a proportion of total ECT value", "Proportion (%)", "", "") |
+----------+------------+-----------------------------------------------------------------------------------------------------------------------------------------------------------------------------------------------------------------------------------------------------------------------------------------------+
1 row in set, 1 warning (0.00 sec)

+----------+------------+-----------------------------------------------------------------------------------------------------------------------------------------------------------------------------------------------------------------------------------------------------------------------------------------------+
| Query_ID | Duration   | Query                                                                                                                                                                                                                                                                                         |
+----------+------------+-----------------------------------------------------------------------------------------------------------------------------------------------------------------------------------------------------------------------------------------------------------------------------------------------+
|        1 | 0.01260025 | insert into new_transactions values("ECTQ.S4AYP", "2004.01", 50.01, "", "F", "Percent", 0, "Electronic Card Transactions (ANZSIC06) - ECT", "Electronic card transactions by mean and proportion", "Actual", "Debit card usage as a proportion of total ECT value", "Proportion (%)", "", "") |
+----------+------------+-----------------------------------------------------------------------------------------------------------------------------------------------------------------------------------------------------------------------------------------------------------------------------------------------+
1 row in set, 1 warning (0.00 sec)




//Update Query

mysql> set profiling=1;
Query OK, 0 rows affected, 1 warning (0.00 sec)

mysql> update new_transactions set status = "F" where period > 2000.00 and period < 2001.99;
Query OK, 0 rows affected (0.04 sec)
Rows matched: 784  Changed: 0  Warnings: 0

mysql> show profiles;
+----------+------------+--------------------------------------------------------------------------------------+
| Query_ID | Duration   | Query                                                                                |
+----------+------------+--------------------------------------------------------------------------------------+
|        1 | 0.03558200 | update new_transactions set status = "F" where period > 2000.00 and period < 2001.99 |
+----------+------------+--------------------------------------------------------------------------------------+
1 row in set, 1 warning (0.00 sec)

+----------+------------+--------------------------------------------------------------------------------------+
| Query_ID | Duration   | Query                                                                                |
+----------+------------+--------------------------------------------------------------------------------------+
|        1 | 0.01986825 | update new_transactions set status = "F" where period > 2000.00 and period < 2001.99 |
+----------+------------+--------------------------------------------------------------------------------------+
1 row in set, 1 warning (0.00 sec)

+----------+------------+--------------------------------------------------------------------------------------+
| Query_ID | Duration   | Query                                                                                |
+----------+------------+--------------------------------------------------------------------------------------+
|        1 | 0.01921900 | update new_transactions set status = "F" where period > 2000.00 and period < 2001.99 |
+----------+------------+--------------------------------------------------------------------------------------+
1 row in set, 1 warning (0.00 sec)




//Join Operation

mysql> create table new_transaction2
    -> (Series_reference varchar(20),
    -> Period decimal(6,2));
Query OK, 0 rows affected (0.05 sec)

mysql> insert into new_transaction2(Series_reference,Period)
    -> select Series_reference,Period from new_transactions;
Query OK, 16359 rows affected (0.19 sec)
Records: 16359  Duplicates: 0  Warnings: 0

mysql> set profiling=1;
Query OK, 0 rows affected, 1 warning (0.00 sec)

mysql> create view new_transactions_join as select * from new_transaction2 natural join new_transactions;
Query OK, 0 rows affected (0.06 sec)

mysql> show profiles;
+----------+------------+---------------------------------------------------------------------------------------------------+
| Query_ID | Duration   | Query                                                                                             |
+----------+------------+---------------------------------------------------------------------------------------------------+
|        1 | 0.05565125 | create view new_transactions_join as select * from new_transaction2 natural join new_transactions |
+----------+------------+---------------------------------------------------------------------------------------------------+
1 row in set, 1 warning (0.00 sec)




//--------------------------------------------------------------------------------------

1.5 SubTask D: Perform Comparative Analysis

       Query		  	|  Without Index (s)       | With Index (s)
_____________________________________________________________________________
       Select(equality)         |   0.02849                |      0.00178  
       Select(range)            |   0.01732                |      0.00079            
       Insert                   |   0.00972                |      0.03688             
       Update                   |   0.03856                |      0.02489                           
       Natural Join             |   0.14092                |      0.05565  

//Index speeds up select and natural join but slows down insert.









